{
  "schema_version": 1,
  "id": "legal.mediation",
  "category": "legal",
  "icon": "legal",
  "name": {
    "en": "Mediation session",
    "pt-BR": "Sessão de mediação"
  },
  "description": {
    "en": "Mediation notes with careful speaker labeling.",
    "pt-BR": "Notas de mediação com rotulagem cuidadosa de falantes."
  },
  "preview": {
    "en": "When a recording (30 min–3 h) mentions “mediation”, summarize with the legal template on device.",
    "pt-BR": "Quando uma gravação (30 min–3 h) mencionar “mediation”, resumir com o modelo jurídico no aparelho."
  },
  "definition": {
    "wake_phrase": "mediation",
    "source_filter": "all",
    "duration_min_seconds": 1800,
    "duration_max_seconds": 10800,
    "template_id": "velum.legal",
    "auto_label_voice": true,
    "language": "auto",
    "notify": true,
    "post_action": null
  }
}
