{
  "schema_version": 1,
  "id": "medical.grand-rounds",
  "category": "medical",
  "icon": "medical",
  "name": {
    "en": "Grand rounds / teaching",
    "pt-BR": "Grand rounds / ensino"
  },
  "description": {
    "en": "Teaching conferences into education-style medical notes.",
    "pt-BR": "Conferências de ensino em notas médicas estilo educação."
  },
  "preview": {
    "en": "When a long recording (40 min–3 h) mentions “grand rounds”, summarize with lecture notes and export to your folder.",
    "pt-BR": "Quando uma gravação longa (40 min–3 h) mencionar “grand rounds”, resumir com notas de aula e exportar para a pasta."
  },
  "definition": {
    "wake_phrase": "grand rounds",
    "source_filter": "all",
    "duration_min_seconds": 2400,
    "duration_max_seconds": 10800,
    "template_id": "velum.education",
    "auto_label_voice": true,
    "language": "auto",
    "notify": true,
    "post_action": "folder_export"
  }
}
