{
  "schema_version": 1,
  "id": "interviews.journalism-source",
  "category": "interviews",
  "icon": "interview",
  "name": {
    "en": "Source interview (journalism)",
    "pt-BR": "Entrevista com fonte (jornalismo)"
  },
  "description": {
    "en": "Interview notes for reporting, exported to your folder.",
    "pt-BR": "Notas de entrevista para reportagem, exportadas para sua pasta."
  },
  "preview": {
    "en": "When a Note Pro recording mentions “source” (20 min–2 h), summarize as interview notes and export Markdown.",
    "pt-BR": "Quando uma gravação do Note Pro mencionar “source” (20 min–2 h), resumir como notas de entrevista e exportar Markdown."
  },
  "definition": {
    "wake_phrase": "source",
    "source_filter": "note_pro",
    "duration_min_seconds": 1200,
    "duration_max_seconds": 7200,
    "template_id": "velum.interview",
    "auto_label_voice": true,
    "language": "auto",
    "notify": true,
    "post_action": "folder_export"
  }
}
