{
  "schema_version": 1,
  "id": "devices.note-pro-longform",
  "category": "devices",
  "icon": "device",
  "name": {
    "en": "Note Pro long-form (≥45 min)",
    "pt-BR": "Note Pro longo (≥45 min)"
  },
  "description": {
    "en": "Only long Note Pro sessions get deep meeting minutes.",
    "pt-BR": "Só sessões longas do Note Pro geram atas profundas."
  },
  "preview": {
    "en": "When a Note Pro recording of at least 45 minutes syncs, summarize with meeting minutes and export to your folder.",
    "pt-BR": "Quando uma gravação do Note Pro de pelo menos 45 minutos sincronizar, resumir com ata e exportar para a pasta."
  },
  "definition": {
    "wake_phrase": null,
    "source_filter": "note_pro",
    "duration_min_seconds": 2700,
    "duration_max_seconds": 10800,
    "template_id": "velum.meeting",
    "auto_label_voice": true,
    "language": "auto",
    "notify": true,
    "post_action": "folder_export"
  }
}
