{
  "schema_version": 1,
  "id": "content.speech-rehearsal",
  "category": "content",
  "icon": "content",
  "name": {
    "en": "Speech rehearsal",
    "pt-BR": "Ensaio de discurso"
  },
  "description": {
    "en": "Practice talks into speech notes for review.",
    "pt-BR": "Ensaios de fala em notas de discurso para revisão."
  },
  "preview": {
    "en": "When a phone recording (5–40 min) mentions “rehearsal”, summarize with the speech template on device.",
    "pt-BR": "Quando uma gravação do telefone (5–40 min) mencionar “rehearsal”, resumir com o modelo de discurso no aparelho."
  },
  "definition": {
    "wake_phrase": "rehearsal",
    "source_filter": "phone",
    "duration_min_seconds": 300,
    "duration_max_seconds": 2400,
    "template_id": "velum.speech",
    "auto_label_voice": false,
    "language": "auto",
    "notify": true,
    "post_action": null
  }
}
