{
  "schema_version": 1,
  "id": "personal.dream-log",
  "category": "personal",
  "icon": "journal",
  "name": {
    "en": "Dream log",
    "pt-BR": "Registro de sonhos"
  },
  "description": {
    "en": "Morning dream captures into a general note.",
    "pt-BR": "Capturas matinais de sonhos em uma nota geral."
  },
  "preview": {
    "en": "When a short phone recording (under 15 min) mentions “dream”, summarize generally on device.",
    "pt-BR": "Quando uma gravação curta do telefone (menos de 15 min) mencionar “dream”, resumir de forma geral no aparelho."
  },
  "definition": {
    "wake_phrase": "dream",
    "source_filter": "phone",
    "duration_min_seconds": 0,
    "duration_max_seconds": 900,
    "template_id": "velum.general",
    "auto_label_voice": false,
    "language": "auto",
    "notify": true,
    "post_action": null
  }
}
