{
  "schema_version": 1,
  "id": "research.conference-talk",
  "category": "research",
  "icon": "research",
  "name": {
    "en": "Conference talk notes",
    "pt-BR": "Notas de palestra em congresso"
  },
  "description": {
    "en": "Talks into speech/lecture notes you can share.",
    "pt-BR": "Palestras em notas de discurso/aula compartilháveis."
  },
  "preview": {
    "en": "When a recording (20–90 min) mentions “keynote” or “conference”, summarize with speech notes and open share.",
    "pt-BR": "Quando uma gravação (20–90 min) mencionar “keynote” ou “conference”, resumir com notas de discurso e abrir compartilhamento."
  },
  "definition": {
    "wake_phrase": "keynote",
    "source_filter": "all",
    "duration_min_seconds": 1200,
    "duration_max_seconds": 5400,
    "template_id": "velum.speech",
    "auto_label_voice": true,
    "language": "auto",
    "notify": true,
    "post_action": "share"
  }
}
